Donor Agency,AMP ID,Project Title,Actual Start Date,Primary Sector,2004 Actual Commitments,2005 Actual Commitments,2006 Actual Commitments,2007 Actual Commitments,2008 Actual Commitments,2009 Actual Commitments,2010 Actual Commitments,2011 Actual Commitments,2012 Actual Commitments,2013 Actual Commitments,2014 Actual Commitments,Total Actual CommitmentsAsian Development Bank,872381652764,TA-Demonstration of sustainable Forest Management with Community Participation in Nepal,01/04/2011,FOREST, , , , , , ,500179, , , , ,500179Asian Development Bank,8723811264,TA:Strengthening the Town Development Fund Capacity for Public-Private Partnership,29/11/2010,URBAN DEVELOPMENT, , , , , , ,250000, , , , ,250000Asian Development Bank,872381386204,Project Preparatory facility for Energy (PPFE),31/01/2014,HYDRO ELECTRICITY, , , , , , , , , ,21000000, ,21000000Asian Development Bank,8723811263,TA:Preparing the Integrated Urban Development Project,13/12/2010,MISCELLANEOUS, , , , , , ,800000, , , , ,800000Asian Development Bank,8723868212,Local Peace Committee,19/12/2008,PEACE AND RECONSTRUCTION, , , , ,4500000, , , , , , ,4500000Asian Development Bank,872381998,Community Livestock Development Program (CLDP),02/12/2005,AGRICULTURE, , , , , , , , , , , ,20000000Asian Development Bank,872381141,Community based Water Supply and Sanitation Sector Project,01/01/2004,DRINKING WATER, , , , , , , , , , , ,24000000Asian Development Bank,872381642,Rural Finance Sector Development-Cluster Program  (Sub Program I),21/11/2006,FINANCIAL REFORM, , ,64700000, , , , , , , , ,64700000Asian Development Bank,872381138,Urban and Environmental Improvement Project,02/10/2003,URBAN DEVELOPMENT, , , , , , , , , , , ,30000000Asian Development Bank,87238112549,Assistance for Support for Targeted and Sustainable Development Programs for Highly Marginalized Groups,08/06/2011,LOCAL DEVELOPMENT, , , , , , ,2700000, , , , ,2700000Asian Development Bank,8723883778,Local Governance and Community Development Program (LGCDP)- I Phase,16/07/2008,LOCAL DEVELOPMENT, , , , , ,106300000, , , , , ,106300000Asian Development Bank,87238845484,Kathmandu Valley Waste water Management Project,31/07/2013,URBAN DEVELOPMENT, , , , , , , , ,80000000, , ,80000000Asian Development Bank,8723868193,Road Connectivity Sector I Project,20/11/2006,ROAD TRANSPORTATION, , ,55000000, , , , , , , , ,55000000Asian Development Bank,872383656,Commercial Agriculture Development Project (CADP),06/08/2007,AGRICULTURE, , ,18000000, , , , , , , , ,18000000Asian Development Bank,8723867182,SASEC Information Highway Project,02/07/2009,COMMUNICATIONS, , , , ,9000000, , , , , , ,9000000Asian Development Bank,8723867188,Emergency Flood Damage Rehabilitation Project,01/11/2009," - AGRICULTURE - IRRIGATION - ROAD TRANSPORTATION", , , , , ,25600000, , , , , ,25600000Asian Development Bank,872381731,Second Small town Water Supply and Sanitation Sector Project,24/01/2010,DRINKING WATER, , , , , ,45100000, , , , , ,45100000Asian Development Bank,8723867187,Air Transport Capacity Enhancement Project,,AIR TRANSPORTATION, , , , , ,75127061.45, , , , , ,75127061.45Asian Development Bank,872382130,Kathmandu Valley Water Services Sector Development Project,08/07/2004,DRINKING WATER, , , , , , , , , , , ,10236885.51Asian Development Bank,8723811542,Kathmandu Valley Water Supply Improvement Project,01/01/2012,DRINKING WATER, , , , , , , ,80000000, , , ,80000000Asian Development Bank,872381194,Secondary Towns Integrated Urban Environmental Improvement Project,,URBAN DEVELOPMENT, , , , , , ,60000000, , , , ,60000000Asian Development Bank,872383050,Gender Equality and Empowerment of Women Project,01/01/2007,"WOMEN, CHILDREN & SOCIAL WELFARE", ,10000000, , , , , , , , , ,10000000Asian Development Bank,8723869224,Kathmandu Sustainable Urban Transport Project,26/01/2011,ROAD TRANSPORTATION, , , , , , ,20000000, , , , ,20000000Asian Development Bank,872385165,Detailed Engineering Study for the Upper Seti Hydropower Project,01/10/2010,ENERGY, , , , , , ,2500000, , , , ,2500000Asian Development Bank,8723868190,Raising Incomes of Small and Medium Farmers Project (RISMFP) - Crops Diversification,,AGRICULTURE, , , , , , ,20100000, , , , ,20100000Asian Development Bank,8723819498,Mountain Agribusiness and Livelihood Improvement (HIMALI) Project,,AGRICULTURE, , , , , , ,20000000, , , , ,20000000Asian Development Bank,8723816186,Capital Markets and Infrastructure Finance Support Project,,FINANCIAL REFORM, , , , , , ,5000000, , , , ,5000000Asian Development Bank,872381702848,School Sector Programme (School Sector Reform Programme)Cofinancing by Australia,,EDUCATION, , , , , , , ,3465000, , , ,3465000Asian Development Bank,872381933897,SASEC Sub-Regional Trade Facilitation Program,25/02/2013,COMMERCE, , , , , , , , ,15000000, , ,15000000Asian Development Bank,8723816168,Rural Finance Sector Development Cluster Program (Sub Program 2),23/03/2011,FINANCIAL REFORM, , , , , , ,72267163.34, , , , ,72267163.34Asian Development Bank,872381428664,Water Resource Preparatory Facility Project,,IRRIGATION, , , , , , , , ,11000000, , ,11000000Asian Development Bank,8723814210,Community Irrigation Project,,LOCAL DEVELOPMENT, , , , , , ,26400000, , , , ,26400000Asian Development Bank,8723869177,Sub Regional Transport Enhancement Project,,ROAD TRANSPORTATION, , , , , , ,49000000, , , , ,49000000Asian Development Bank,8723869241,Transport Project Preparatory Facility Nepal,,ROAD TRANSPORTATION, , , , , , ,12000000, , , , ,12000000Asian Development Bank,8723868192,South Asia Tourism Infrastructure Development Project,,TOURISM, , , , , ,25500000, , , ,33000000, ,58500000Asian Development Bank,87238312320,Integrated Urban Development Project (Nepal),04/07/2012,URBAN DEVELOPMENT, , , , , , , ,12000000, , , ,12000000Asian Development Bank,87238112461,Nepal Registration programme (JFPR 9157-NEP: Reducing Child Malnutrition through Social Protection ),08/06/2011,LOCAL DEVELOPMENT, , , , , , ,2000000, , , , ,2000000Asian Development Bank,8723863210223,Establishing Women and Children Service Centres- Additional Financing,,HOME, , , , , , , , , , ,300000,300000Asian Development Bank,87238206247,TA 7992-NEP: Skills Development Project,01/08/2013,EDUCATION, , , , , , , , , ,20000000, ,20000000Asian Development Bank,872381656286,Building Climate Resilience of Watersheds in Mountain Eco-Regions,20/01/2014,FOREST, , , , , , , , , ,23500000, ,23500000Asian Development Bank,8723816649,Electricity Transmission Expansion and Supply Improvement Project (ETESIP),23/03/2012,ELECTRICITY, , , , , , , ,75000000, , , ,75000000Asian Development Bank,872381335,Community-Managed Irrigated Agriculture (Sector) Project CMIASP,01/07/2006," - AGRICULTURE - IRRIGATION", ,20000000, , , , , , , , , ,20000000Asian Development Bank,8723883713,Rural Reconstruction and Rehabilitation Sector Development Program[RRRSDP],01/02/2008,LOCAL DEVELOPMENT, , , ,100000000, , , , , , , ,100000000Asian Development Bank,87238588,Energy Access and Efficiency Improvement Project (EAEIP),04/06/2010,ELECTRICITY, , , , , ,67683103.73, , , , , ,67683103.73Asian Development Bank,872381559,Skills for Employment Project,28/02/2006,EDUCATION,20000000, , , , , , , , , , ,20000000Asian Development Bank,872384729490,Third Small Town Water Supply and Sanitation Sector Project,25/11/2014,DRINKING WATER, , , , , , , , , , ,61300000,61300000Asian Development Bank,872382637149,TA for Nepal: Supporting Education and Skills Development,19/01/2014,EDUCATION, , , , , , , , , ,1000000, ,1000000Asian Development Bank,872381432697,TA 9135-NEP: Establishing Women and Children Service Centers,19/01/2010,HOME, , , , , ,750000, , ,3000000, , ,3750000Asian Development Bank,872383296200,SASEC Road Connectivity Project,,ROAD TRANSPORTATION, , , , , , , , , ,75000000, ,75000000Asian Development Bank,,Second Phase of Decentralized Rural Infrastructure and Livelihood Project.,01/02/2012,LOCAL DEVELOPMENT, , , , , , , ,25000000, , , ,25000000Asian Development Bank,872382368,Decentralized Rural Infrastructure and Livelihood Project (DRILP),31/10/2005,LOCAL DEVELOPMENT,40000000, , , , , , , , , , ,40000000Asian Development Bank,8723814220,Japan Fund for Poverty Reduction(JFPR) 9141 NEP  Capacity Building for the Promotion of Legal Identity among the Poor in Nepal,,LOCAL DEVELOPMENT, , , , , ,2000000, , , , , ,2000000Asian Development Bank,87238311242,Nepal Strengthening Public Management Program,27/03/2013,LOCAL DEVELOPMENT, , , , , , , , ,21500000, , ,21500000Asian Development Bank,872385111,Information and Communication Technology Development Project (ICTDP),10/05/2010,COMMUNICATIONS, , , ,25000000, , , , , , , ,25000000Asian Development Bank,872381714600,Tanahu Hydropower Project,13/03/2013,ENERGY, , , , , , , , ,150000000, , ,150000000Asian Development Bank,8723883742,School sector Reform Program (SSRP),01/01/2010,EDUCATION, , , , , ,95805085.97, ,65000000, , , ,160805086Asian Development Bank,8723892735,Melamchi Drinking Water Project,28/11/2001,DRINKING WATER, , , ,137000000, , , , , , , ,137000000Canadian International Development Agency,8723851751,Micro-Enterprise Development Programme (MEDEP) III,,INDUSTRY, , , , , , ,1222743.02, , , , ,1222743.02Canadian International Development Agency,8723883778,Local Governance and Community Development Program (LGCDP)- I Phase,16/07/2008,LOCAL DEVELOPMENT, , , , , , ,8503401.36, , , , ,8503401.36China,872381713627,Upper Trishuli 3A - Kathmandu 220kV Transmission Line and 132kV Line Bay Extension Works Project,,HYDRO ELECTRICITY, , , , , , , , ,24335542, , ,24335542China,872383506255,Nepal National Armed Police Academy,,HOME, , , , , , , , ,32624830.76, , ,32624830.76China,872381431810,Enhance the capacity of Police Forces of Nepal.,17/08/2011,HOME, , , , , , , ,939246.411, , , ,939246.411China,872381431824,Armed Police Force College,14/01/2012,HOME, , , , , , , ,62960.397, , , ,62960.397China,872381431811,Security Equipment for the Police.,17/08/2011,HOME, , , , , , , ,1565410.685, , , ,1565410.685China,87238311310,Enhancement of Nepal Police,14/01/2012,HOME, , , , , , , ,1574009.947, , , ,1574009.947China,87238511105,Donation of security equipment,,HOME, , , , , ,3831135.342, , , , , ,3831135.342China,872385166,Upper Trishuli 3A Hydroelectric Project,28/02/2011,ELECTRICITY, , , , , , ,97307323.9,31934377.98, , , ,129241701.9China,872381270,Syaprubesi Rasuwagadhi Road Project,17/12/2007,ROAD TRANSPORTATION, , , ,32544378.7, , , , , , , ,32544378.7China,8723851223,Economic and technical cooperation (small projects),28/02/2010,OTHERS - ECONOMIC, , , , , ,21960325.01,18135736.87,54961359.24, ,19516637.93, ,114574059.1China,872381437848,Procurement of Aircrafts from China ( 1 MA 60 3 Y12E ),28/11/2013,TOURISM, , , , , , , , , ,27900000, ,27900000China,87238314638,Budgetary Support (China),,ENERGY, , , , , , , ,20000000, , , ,20000000Denmark,8723889744,UN Joint programme of support to LGCDP,01/04/2009,LOCAL DEVELOPMENT, , , , , ,2155875.269, , , , , ,2155875.269Denmark,8723883778,Local Governance and Community Development Program (LGCDP)- I Phase,16/07/2008,LOCAL DEVELOPMENT, , , , , ,12072901.51, , , , , ,12072901.51Denmark,8723814104,Nepal Peace Trust Fund (NPTF),27/02/2007,PEACE AND RECONSTRUCTION, , ,1724700.215,1724700.215, , , , , , , ,3449400.431Denmark,8723868213,Energy Sector Assistance Programme Phase II (ESAP II),15/03/2007,ALTERNATE ENERGY, , ,25870503.24, , , , , , , , ,25870503.24Denmark,8723831145,"Human Rights and Good Governance Program, Phase III (2009-13)",29/10/2008,OTHERS - SOCIAL, , , , ,17247002.16, , , , , , ,17247002.16Denmark,872381406960,UNNATI- Inclusive Growth Programme in Nepal,16/12/2013,AGRICULTURE, , , , , , , , , ,73706904.49, ,73706904.49Denmark,8723878523,"Nepal Peace Support Programme, phase III",24/05/2011,PEACE AND RECONSTRUCTION, , , , , , ,7596042.461, , , , ,7596042.461Denmark,87238112623,National Rural and Renewable Energy Programme(NRREP),18/07/2012,ALTERNATE ENERGY, , , , , , , , ,35636679.7, , ,35636679.7Denmark,872383227093,"Peace Rights and Governance Program, Phase Iv (2014-18)",16/12/2013,PEACE AND RECONSTRUCTION, , , , , , , , , ,36853452.25, ,36853452.25Denmark,8723883742,School sector Reform Program (SSRP),01/01/2010,EDUCATION, , , , , ,37943404.75, ,22588456.4, , , ,60531861.14Denmark,8723851249,Institutional Strengthening and Professional Development Support for the Election commission of Nepal,01/08/2008,CONSTITUTIONAL BODIES, , , , , , ,2100000,230000,740000, , ,3070000Department for International Development,8723889741,Assistance to the Peace Process in Nepal,01/01/2007,PEACE AND RECONSTRUCTION, , ,567714.654, ,212000, , , , , , ,779714.654Department for International Development,8723814179,Community Support Programme,16/06/2011,LOCAL DEVELOPMENT, , , , , , ,10700389.11,17596229.38,9075056.009, , ,37371674.49Department for International Development,8723831147,Financial Sector Technical Assistance Project,30/04/2003,FINANCIAL REFORM, , , , , , , , , , , ,11804145.62Department for International Development,8723823133,Support to National HIV/AIDS Programme - SNHP,02/10/2006,HEALTH, ,6830222.812, ,7001120.179,3233392.122,5576637.518,2558649.717,25099.984, , , ,25225122.34Department for International Development,8723889744,UN Joint programme of support to LGCDP,01/04/2009,LOCAL DEVELOPMENT, , , , , ,2305209.774, , , , , ,2305209.774Department for International Development,8723883714,NEPAL RURAL ACCESS PROGRAMME PHASE- II,,LOCAL DEVELOPMENT, , , , ,58849123.67, , , , , , ,58849123.67Department for International Development,872381485,Pilot Trail Bridge Support Program,,LOCAL DEVELOPMENT, , , , , ,3047851.264, , , , , ,3047851.264Department for International Development,8723883778,Local Governance and Community Development Program (LGCDP)- I Phase,16/07/2008,LOCAL DEVELOPMENT, , , , ,24088025.38, , , , , , ,24088025.38Department for International Development,8723814104,Nepal Peace Trust Fund (NPTF),27/02/2007,PEACE AND RECONSTRUCTION, , ,59450273.52, , ,28488457.45, , , ,6286342.92, ,94225073.89Department for International Development,8723868213,Energy Sector Assistance Programme Phase II (ESAP II),15/03/2007,ALTERNATE ENERGY, , , , , , ,3221649.484, , , , ,3221649.484Department for International Development,8723863210223,Establishing Women and Children Service Centres- Additional Financing,,HOME, , , , , , , , , , ,3200000,3200000Department for International Development,8723883713,Rural Reconstruction and Rehabilitation Sector Development Program[RRRSDP],01/02/2008,LOCAL DEVELOPMENT, , , , ,19386012.75, , , , , , ,19386012.75Department for International Development,8723883662,Nepal Health Sector Programme NHSP-II,18/08/2010,HEALTH, , , , , , ,115477145.1, , , , ,115477145.1Department for International Development,8723823125,Strengthening the Capacity of the National Human Rights Commission of Nepal (SCNHRC),19/07/2009,CONSTITUTIONAL BODIES, , , , , ,332612.672, , , , , ,332612.672Department for International Development,8723893300,Multi Stakeholder Forestry Programme (MSFP),23/01/2012,FOREST, , , , , , ,32310177.71, , , , ,32310177.71Department for International Development,87238311242,Nepal Strengthening Public Management Program,27/03/2013,LOCAL DEVELOPMENT, , , , , , , , ,6500000, , ,6500000Department for International Development,87238764332,Nepal Family Planning Project - Family Planning Services for Excluded and Vulnerable Groups,01/09/2013,HEALTH, , , , , , , , ,23156611.82, , ,23156611.82Department for International Development,87238841212,Nepal Climate Change Support Programme: Building Climate Resilience in Nepal(NCCSP),,"ENVIRONMENT,SCIENCE & TECHNOLOGY", , , , , , , ,10997643.36, , , ,10997643.36Department for International Development,872381433633,Rural Access Programme Phase III,31/01/2013,LOCAL DEVELOPMENT, , , , , , , , ,54453229.9, , ,54453229.9Department for International Development,8723883742,School sector Reform Program (SSRP),01/01/2010,EDUCATION, , , , , ,19179894.18, , , ,3255738.238, ,22435632.42Department for International Development,8723851249,Institutional Strengthening and Professional Development Support for the Election commission of Nepal,01/08/2008,CONSTITUTIONAL BODIES, , , , , ,1447003.159,595892,666514.985,7421576.497, , ,10130986.64Department for International Development,872381436033,"Local Governance and Community Development Programme, Phase II (LGCDP II)",11/12/2013,LOCAL DEVELOPMENT, , , , , , , , , ,114080834.4, ,114080834.4Department for International Development,8723863211921,Integrated Programme for Strengthening Security and Justice (IP-SSJ),31/12/2014," - HOME - WOMEN, CHILDREN & SOCIAL WELFARE", , , , , , , , , , ,51268531.47,51268531.47Economic Development Cooperation Fund  Korea,8723816144,Chameliya Hydro Electric Project,07/05/2009,ELECTRICITY, , , , ,45000000, , , , , , ,45000000European Investment Bank,872381712901,Bhaktapur - Baneshwor 132kV Transmission System Project,,ELECTRICITY, , , , , , , ,25360000, , , ,25360000European Investment Bank,872381714600,Tanahu Hydropower Project,13/03/2013,ENERGY, , , , , , , , ,70000000, , ,70000000European Union,872383227118,Public Finance Management (PFM) reforms in Nepal,,FINANCIAL REFORM, , , , , , , , , ,13666803.33, ,13666803.33European Union,8723823120,Disaster Risk Reduction at the National Level in Nepal - DRRNLN,15/11/2007," - MISCELLANEOUS - URBAN DEVELOPMENT", , , ,380680, ,774164, , , , , ,1154844European Union,8723814104,Nepal Peace Trust Fund (NPTF),27/02/2007,PEACE AND RECONSTRUCTION, , , , , , ,34977740.49, , , , ,34977740.49European Union,87238841212,Nepal Climate Change Support Programme: Building Climate Resilience in Nepal(NCCSP),,"ENVIRONMENT,SCIENCE & TECHNOLOGY", , , , , , , ,11566913.25, , , ,11566913.25European Union,8723883742,School sector Reform Program (SSRP),01/01/2010,EDUCATION, , , ,37825059.1, ,84027593, , , ,84469393.21, ,206322045.3European Union,8723851249,Institutional Strengthening and Professional Development Support for the Election commission of Nepal,01/08/2008,CONSTITUTIONAL BODIES, , , , , , , , ,10964626.03, , ,10964626.03Finland,872381652763,Improving Research Capacity of Forest Resource Information Technology  (IRCFRIT),01/01/2010,FOREST, , , , , ,357974, , , , , ,357974Finland,872381435804,"Rural Water Supply and Sanitation Project in Western Nepal, Completion Phase (RWSSP- WN II)",16/09/2013,LOCAL DEVELOPMENT, , , , , , , , , ,18305718.87, ,18305718.87Finland,8723897758,Forest Resource Assessment in Nepal,,FOREST, , , , ,6408508.317, , , , ,765700.16, ,7174208.477Finland,8723897729,Rural Water Supply and Sanitation Project in Western Nepal [RWSSP-WN],01/08/2008,LOCAL DEVELOPMENT, , , ,15292356.19, , , , , , , ,15292356.19Finland,8723897752,"Strengthening of Environmental Administration and Management at the Local Level [SEAM,N]",01/08/2008,LOCAL DEVELOPMENT, , , ,5516154.452, , , ,4034969.737, , , ,9551124.19Finland,8723897750,Rural Village Water Resource Management Project Phase- II,21/05/2010,LOCAL DEVELOPMENT, , , , , ,16972592.41, , , , , ,16972592.41Finland,8723897756,Regional Waste Management Project (RWMP),27/04/2010,LOCAL DEVELOPMENT, , , , , ,5883926.183, , , , , ,5883926.183Finland,8723814104,Nepal Peace Trust Fund (NPTF),27/02/2007,PEACE AND RECONSTRUCTION, , ,4030632.809, , , ,4689803.028, , , , ,8720435.837Finland,8723823125,Strengthening the Capacity of the National Human Rights Commission of Nepal (SCNHRC),19/07/2009,CONSTITUTIONAL BODIES, , , , , ,573394.495, , , ,277739.202, ,851133.698Finland,8723893300,Multi Stakeholder Forestry Programme (MSFP),23/01/2012,FOREST, , , , , , , ,13718897.11, , , ,13718897.11Finland,8723883742,School sector Reform Program (SSRP),01/01/2010,EDUCATION, , , , , ,21396095.21, , , , , ,21396095.21Food and Agriculture Organization,87238107706,Support to Mitigate the Negative Effects of High Food Prices on Local Rural Populations in Ten Districts,01/05/2009,AGRICULTURE, , , , , ,11813799.62, , , , , ,11813799.62Food and Agriculture Organization,872381652757,Support to the Development and Piloting of an Open Source Cadastre and Registration (OSCAR) Software Shell,01/01/2011,LAND REFORM & SURVEY, , , , , , ,2900000, , , , ,2900000Food and Agriculture Organization,872381402778,Urgent Food Security Assistance to Severely Food Insecure Rural Households in Karnali-Bheri Regions of Nepal,,AGRICULTURE, , , , , , , ,796886, , , ,796886Food and Agriculture Organization,872381402876,ReTA on Ecosystem Based Adaptation in Mountain Ecosystems in Nepal,16/08/2012,FOREST, , , , , , , , ,3372637, , ,3372637German Development Cooperation (GIZ),8723816219,Federalism Support Programme Phase II,,PEACE AND RECONSTRUCTION, , , , ,1499863.648, , , , , , ,1499863.648German Development Cooperation (GIZ),8723814104,Nepal Peace Trust Fund (NPTF),27/02/2007,PEACE AND RECONSTRUCTION, , , , ,2523659.305, , ,2515406.867, , ,-1280068.5,3758997.673German Development Cooperation (KfW),8723816115,Middle Marsyangdi Hydrolectric Project,23/02/1999,ELECTRICITY,28445504.23, , ,41306623.09, , , , , , , ,201994642.2German Development Cooperation (KfW),8723814104,Nepal Peace Trust Fund (NPTF),27/02/2007,PEACE AND RECONSTRUCTION, , , , ,1261829.652, , ,2689979.825, , , ,3951809.478German Development Cooperation (KfW),8723868197,Sector Program Health and Family Planning,09/07/2008,HEALTH, , , ,15760441.29, , , , , , , ,15760441.29German Development Cooperation (KfW),8723831114,Load Dispatch Center Extension,04/12/1997,ELECTRICITY, , , , , , , , , , , ,23949501.1German Development Cooperation (KfW),8723851444,Nepal District Health Programme,,HEALTH, , , ,5144562.197, , , , , , , ,5144562.197German Development Cooperation (KfW),872382625,Town Development Fund Project (phase III),26/05/2009,URBAN DEVELOPMENT, , , , ,10226343.06, , , , , , ,10226343.06German Development Cooperation (KfW),8723811522,Town Development Fund Project (phase II),15/12/2000,URBAN DEVELOPMENT, , , , , , , , , , , ,6449406.571German Development Cooperation (KfW),8723868213,Energy Sector Assistance Programme Phase II (ESAP II),15/03/2007,ALTERNATE ENERGY, , , , , ,11558335.6, , , , , ,11558335.6German Development Cooperation (KfW),8723883662,Nepal Health Sector Programme NHSP-II,18/08/2010,HEALTH, , , , , , , ,13142331.45, , , ,13142331.45German Development Cooperation (KfW),872381147,Biogas Support Program - Phase IV,01/07/2003,ALTERNATE ENERGY, , , , , , , , , , , ,8141996.417German Nepal Help Association,872381433408,Nepalese - German Manuscript Cataloguing Project,02/08/2002,TOURISM, , , , , , , , ,2241901.132, , ,2241901.132Global Alliance for Vaccines and Immunisation,8723868200,Nepal Health Sector Program II (NHSP II) - GAVI,,HEALTH, , , , , , ,14473745, , , , ,14473745Global Alliance for Vaccines and Immunisation,87238511289,Procurement of vaccines (Pentavalent),,HEALTH, , , ,29164000, , , , , , ,4930614,34094614Global Environment Facility,87238113636,Forest restoration and sustainable land management in the Churia Range to combat land degradation,,FOREST, , , , , , , , ,1600000, , ,1600000Global Environment Facility,8723869224,Kathmandu Sustainable Urban Transport Project,26/01/2011,ROAD TRANSPORTATION, , , , , , ,2520000, , , , ,2520000"Global Fund to Fight AIDS, Tuberculosis and Malaria",8723823133,Support to National HIV/AIDS Programme - SNHP,02/10/2006,HEALTH, , ,4935646, ,43000,30717,44282,586782,-166292, , ,5474135"Global Fund to Fight AIDS, Tuberculosis and Malaria",8723851222,Scaling Up Coverage and Quality of HIV & AIDS Prevention targeted to Most at Risk Population and Treatment Care and Support Services to PLHA,01/01/2009,HEALTH, , , , ,6734717, , ,5597346,-276677, , ,12055386"Global Fund to Fight AIDS, Tuberculosis and Malaria",8723851537,Scaling Up Coverage and Quality of HIV & AIDS Prevention targeted to Most at Risk Population and Treatment Care and Support Services to PLHA / Save the Children,01/11/2008,HEALTH, , , , ,2944832, ,3593187, , , , ,6538019"Global Fund to Fight AIDS, Tuberculosis and Malaria",8723851635,Scaling up coverage and quality of HIV AIDS prevention targeted to most at risk populations and treatment care and support services to PLWHA / Family Planning Association,16/11/2008,HEALTH, , , , ,5936900, , , ,434212, , ,6371112"Global Fund to Fight AIDS, Tuberculosis and Malaria",8723851637,Scaling up coverage and quality of HIV AIDS prevention targeted to most at risk populations and treatment care and support services to PLHA,01/07/2011,HEALTH, , , , , , ,2229104, , , , ,2229104"Global Fund to Fight AIDS, Tuberculosis and Malaria",87238511947,"Nepal Round 10 Proposal to Contribute to the Achievement of Millennium Development Goals 4,5,6",21/02/2012,HEALTH, , , , , , , ,11396254, , , ,11396254"Global Fund to Fight AIDS, Tuberculosis and Malaria",8723851642,Scaling up coverage and quality of malaria prevention and control in targeted high risk districts in Nepal (2008-2013),16/09/2008,HEALTH, , , , ,2101608, , , , , , ,2101608"Global Fund to Fight AIDS, Tuberculosis and Malaria",8723851641,Scaling up coverage and quality of malaria prevention and control in targeted high risk districts in Nepal / PSI,16/09/2008,HEALTH, , , ,7024844, , , , , , , ,7024844"Global Fund to Fight AIDS, Tuberculosis and Malaria",87238511948,"Nepal Round 10 Proposal to Contribute to the Achievement of MDGs, 4,5,6 / Save the Children",08/02/2012,HEALTH, , , , , , , ,10219990, , , ,10219990"Global Fund to Fight AIDS, Tuberculosis and Malaria",87238512057,Expansion of malaria prevention and control to At-Risk populations in Nepal 2010-2016 N,,HEALTH, , , , , , , ,2519091, , , ,2519091"Global Fund to Fight AIDS, Tuberculosis and Malaria",8723851221,Implementation of Stop TB Strategy (2010-2015),16/07/2010,HEALTH, , , , , , ,28403176, , , , ,28403176